First Name,Last Name,Email,Phone,Birthday,Notes
John,Smith,john.smith@example.com,+1-555-123-4567,1985-03-15,Met at tech conference 2024. Interested in AI and startups.
Sarah,Johnson,sarah.j@example.com,+1-555-234-5678,1990-07-22,Designer at Tesla. Passionate about sustainable tech.
Michael,Chen,m.chen@example.com,+1-555-345-6789,1988-11-05,Software engineer. Met through LinkedIn.
Emily,Davis,emily.davis@example.com,+1-555-456-7890,1992-04-18,Product manager at Google. Interested in AI UX.
David,Wilson,david.w@example.com,+1-555-567-8901,1987-09-30,Investor. Met at startup pitch event.
